{"corpus_shape":{"aex_count":5,"supplier_count":3},"matrix_shape":{"depth_count":3,"parameter_shape_count":2,"render_path_count":2,"time_count":2},"missing_suite_aggregation":[],"records":[{"classification":"host_validation_error","depth":"argb16","error_code":null,"evidence":{"path":"evidence/gap-000001.json","sha256":"e4595381cb23ea637e3618e1574f1d5931f780439c1cc0256bc482969ddcb84b"},"gap_id":"gap-000001","missing_suites":[],"occurrence_count":2,"parameter_shape":[],"render_path":"classic","replay":["python","tools/run-real-aex-corpus.py","--inventory","<PUBLIC_INVENTORY>","--locator","<PRIVATE_LOCATOR>","--matrix","<MATRIX>","--runner","<PINNED_RUNNER>","--input","<INPUT>","--out","<NEW_PUBLIC_OUT>","--private-evidence-out","<NEW_PRIVATE_OUT>","--case-list","<PRIVATE_CASE_LIST>"],"stage":"host_validation","time":{"scale":1,"value":0}},{"classification":"host_validation_error","depth":"argb16","error_code":null,"evidence":{"path":"evidence/gap-000002.json","sha256":"79b8955a53ef511cadfa5adc19e12f26b5ab412d694dbed54705ddb0be6fbdc0"},"gap_id":"gap-000002","missing_suites":[],"occurrence_count":2,"parameter_shape":[],"render_path":"classic","replay":["python","tools/run-real-aex-corpus.py","--inventory","<PUBLIC_INVENTORY>","--locator","<PRIVATE_LOCATOR>","--matrix","<MATRIX>","--runner","<PINNED_RUNNER>","--input","<INPUT>","--out","<NEW_PUBLIC_OUT>","--private-evidence-out","<NEW_PRIVATE_OUT>","--case-list","<PRIVATE_CASE_LIST>"],"stage":"host_validation","time":{"scale":1,"value":1}},{"classification":"host_validation_error","depth":"argb16","error_code":null,"evidence":{"path":"evidence/gap-000003.json","sha256":"77e032c9b3289265b5d99c500b03c762cb0ac6ba53c9e45b98512ef6f547d064"},"gap_id":"gap-000003","missing_suites":[],"occurrence_count":5,"parameter_shape":[{"index":1,"type":"slider"}],"render_path":"classic","replay":["python","tools/run-real-aex-corpus.py","--inventory","<PUBLIC_INVENTORY>","--locator","<PRIVATE_LOCATOR>","--matrix","<MATRIX>","--runner","<PINNED_RUNNER>","--input","<INPUT>","--out","<NEW_PUBLIC_OUT>","--private-evidence-out","<NEW_PRIVATE_OUT>","--case-list","<PRIVATE_CASE_LIST>"],"stage":"host_validation","time":{"scale":1,"value":0}},{"classification":"host_validation_error","depth":"argb16","error_code":null,"evidence":{"path":"evidence/gap-000004.json","sha256":"91e32c9f7ea1a3116b90f3e1a68add2e8c7aec7d8a1104035a6abd0138c5ff1a"},"gap_id":"gap-000004","missing_suites":[],"occurrence_count":5,"parameter_shape":[{"index":1,"type":"slider"}],"render_path":"classic","replay":["python","tools/run-real-aex-corpus.py","--inventory","<PUBLIC_INVENTORY>","--locator","<PRIVATE_LOCATOR>","--matrix","<MATRIX>","--runner","<PINNED_RUNNER>","--input","<INPUT>","--out","<NEW_PUBLIC_OUT>","--private-evidence-out","<NEW_PRIVATE_OUT>","--case-list","<PRIVATE_CASE_LIST>"],"stage":"host_validation","time":{"scale":1,"value":1}},{"classification":"host_validation_error","depth":"argb16","error_code":null,"evidence":{"path":"evidence/gap-000005.json","sha256":"66b521a1c11f0036bf6cf930962d5062500c6d02b944b2eb042e56ea528eb26c"},"gap_id":"gap-000005","missing_suites":[],"occurrence_count":4,"parameter_shape":[{"index":1,"type":"slider"}],"render_path":"smartfx","replay":["python","tools/run-real-aex-corpus.py","--inventory","<PUBLIC_INVENTORY>","--locator","<PRIVATE_LOCATOR>","--matrix","<MATRIX>","--runner","<PINNED_RUNNER>","--input","<INPUT>","--out","<NEW_PUBLIC_OUT>","--private-evidence-out","<NEW_PRIVATE_OUT>","--case-list","<PRIVATE_CASE_LIST>"],"stage":"host_validation","time":{"scale":1,"value":0}},{"classification":"host_validation_error","depth":"argb16","error_code":null,"evidence":{"path":"evidence/gap-000006.json","sha256":"6a7ebc4f4039199792b6a1828b379551db6f284967fdc6f196797ce5db8effc3"},"gap_id":"gap-000006","missing_suites":[],"occurrence_count":4,"parameter_shape":[{"index":1,"type":"slider"}],"render_path":"smartfx","replay":["python","tools/run-real-aex-corpus.py","--inventory","<PUBLIC_INVENTORY>","--locator","<PRIVATE_LOCATOR>","--matrix","<MATRIX>","--runner","<PINNED_RUNNER>","--input","<INPUT>","--out","<NEW_PUBLIC_OUT>","--private-evidence-out","<NEW_PRIVATE_OUT>","--case-list","<PRIVATE_CASE_LIST>"],"stage":"host_validation","time":{"scale":1,"value":1}},{"classification":"host_validation_error","depth":"argb32f","error_code":null,"evidence":{"path":"evidence/gap-000007.json","sha256":"fc34708500e395e561ff100f9d712722ec958b730151513065ff64c6db197c17"},"gap_id":"gap-000007","missing_suites":[],"occurrence_count":2,"parameter_shape":[],"render_path":"classic","replay":["python","tools/run-real-aex-corpus.py","--inventory","<PUBLIC_INVENTORY>","--locator","<PRIVATE_LOCATOR>","--matrix","<MATRIX>","--runner","<PINNED_RUNNER>","--input","<INPUT>","--out","<NEW_PUBLIC_OUT>","--private-evidence-out","<NEW_PRIVATE_OUT>","--case-list","<PRIVATE_CASE_LIST>"],"stage":"host_validation","time":{"scale":1,"value":0}},{"classification":"host_validation_error","depth":"argb32f","error_code":null,"evidence":{"path":"evidence/gap-000008.json","sha256":"03b32450cdee61554a4bd1258ac51a5ae9c9e0b474617e3dd3bf63c28836c8fa"},"gap_id":"gap-000008","missing_suites":[],"occurrence_count":2,"parameter_shape":[],"render_path":"classic","replay":["python","tools/run-real-aex-corpus.py","--inventory","<PUBLIC_INVENTORY>","--locator","<PRIVATE_LOCATOR>","--matrix","<MATRIX>","--runner","<PINNED_RUNNER>","--input","<INPUT>","--out","<NEW_PUBLIC_OUT>","--private-evidence-out","<NEW_PRIVATE_OUT>","--case-list","<PRIVATE_CASE_LIST>"],"stage":"host_validation","time":{"scale":1,"value":1}},{"classification":"host_validation_error","depth":"argb32f","error_code":null,"evidence":{"path":"evidence/gap-000009.json","sha256":"327e25d80cc361321565095ffde24d75a9f136685f8527aa6a20b91072202650"},"gap_id":"gap-000009","missing_suites":[],"occurrence_count":5,"parameter_shape":[{"index":1,"type":"slider"}],"render_path":"classic","replay":["python","tools/run-real-aex-corpus.py","--inventory","<PUBLIC_INVENTORY>","--locator","<PRIVATE_LOCATOR>","--matrix","<MATRIX>","--runner","<PINNED_RUNNER>","--input","<INPUT>","--out","<NEW_PUBLIC_OUT>","--private-evidence-out","<NEW_PRIVATE_OUT>","--case-list","<PRIVATE_CASE_LIST>"],"stage":"host_validation","time":{"scale":1,"value":0}},{"classification":"host_validation_error","depth":"argb32f","error_code":null,"evidence":{"path":"evidence/gap-000010.json","sha256":"897a8695aa1f0715d7061bbf065bb35fb2669cf06f88c3df5bfe1848ad254d1c"},"gap_id":"gap-000010","missing_suites":[],"occurrence_count":5,"parameter_shape":[{"index":1,"type":"slider"}],"render_path":"classic","replay":["python","tools/run-real-aex-corpus.py","--inventory","<PUBLIC_INVENTORY>","--locator","<PRIVATE_LOCATOR>","--matrix","<MATRIX>","--runner","<PINNED_RUNNER>","--input","<INPUT>","--out","<NEW_PUBLIC_OUT>","--private-evidence-out","<NEW_PRIVATE_OUT>","--case-list","<PRIVATE_CASE_LIST>"],"stage":"host_validation","time":{"scale":1,"value":1}},{"classification":"host_validation_error","depth":"argb32f","error_code":null,"evidence":{"path":"evidence/gap-000011.json","sha256":"2502ac3bd9660d541d6bd081b0b4fce7860823e91d925e56092aca2a6f76ae14"},"gap_id":"gap-000011","missing_suites":[],"occurrence_count":4,"parameter_shape":[{"index":1,"type":"slider"}],"render_path":"smartfx","replay":["python","tools/run-real-aex-corpus.py","--inventory","<PUBLIC_INVENTORY>","--locator","<PRIVATE_LOCATOR>","--matrix","<MATRIX>","--runner","<PINNED_RUNNER>","--input","<INPUT>","--out","<NEW_PUBLIC_OUT>","--private-evidence-out","<NEW_PRIVATE_OUT>","--case-list","<PRIVATE_CASE_LIST>"],"stage":"host_validation","time":{"scale":1,"value":0}},{"classification":"host_validation_error","depth":"argb32f","error_code":null,"evidence":{"path":"evidence/gap-000012.json","sha256":"8b24bff179b207ba4ec1d03b31a4f8325e40d0ffb44374b300c861af89671602"},"gap_id":"gap-000012","missing_suites":[],"occurrence_count":4,"parameter_shape":[{"index":1,"type":"slider"}],"render_path":"smartfx","replay":["python","tools/run-real-aex-corpus.py","--inventory","<PUBLIC_INVENTORY>","--locator","<PRIVATE_LOCATOR>","--matrix","<MATRIX>","--runner","<PINNED_RUNNER>","--input","<INPUT>","--out","<NEW_PUBLIC_OUT>","--private-evidence-out","<NEW_PRIVATE_OUT>","--case-list","<PRIVATE_CASE_LIST>"],"stage":"host_validation","time":{"scale":1,"value":1}},{"classification":"host_validation_error","depth":"argb8","error_code":null,"evidence":{"path":"evidence/gap-000013.json","sha256":"25fa79ceac58105125249ae770f59c12322a1aa39ae7ec527c64fd89a8c95be4"},"gap_id":"gap-000013","missing_suites":[],"occurrence_count":1,"parameter_shape":[],"render_path":"classic","replay":["python","tools/run-real-aex-corpus.py","--inventory","<PUBLIC_INVENTORY>","--locator","<PRIVATE_LOCATOR>","--matrix","<MATRIX>","--runner","<PINNED_RUNNER>","--input","<INPUT>","--out","<NEW_PUBLIC_OUT>","--private-evidence-out","<NEW_PRIVATE_OUT>","--case-list","<PRIVATE_CASE_LIST>"],"stage":"host_validation","time":{"scale":1,"value":0}},{"classification":"host_validation_error","depth":"argb8","error_code":null,"evidence":{"path":"evidence/gap-000014.json","sha256":"cb36eac2d8cba885c0ba08000b804b8a732074b789e6182d3e2ec1178820e284"},"gap_id":"gap-000014","missing_suites":[],"occurrence_count":1,"parameter_shape":[],"render_path":"classic","replay":["python","tools/run-real-aex-corpus.py","--inventory","<PUBLIC_INVENTORY>","--locator","<PRIVATE_LOCATOR>","--matrix","<MATRIX>","--runner","<PINNED_RUNNER>","--input","<INPUT>","--out","<NEW_PUBLIC_OUT>","--private-evidence-out","<NEW_PRIVATE_OUT>","--case-list","<PRIVATE_CASE_LIST>"],"stage":"host_validation","time":{"scale":1,"value":1}},{"classification":"host_validation_error","depth":"argb8","error_code":null,"evidence":{"path":"evidence/gap-000015.json","sha256":"764bf70f095f13880a0b6c37931636af2f9ed7fb22add0893bc7f7f15c947abe"},"gap_id":"gap-000015","missing_suites":[],"occurrence_count":4,"parameter_shape":[{"index":1,"type":"slider"}],"render_path":"classic","re